[
  {
    "id": "en-staging-001",
    "locale": "en-US",
    "category": "staging",
    "severity": "P1",
    "evidence": "E2",
    "type": "regex",
    "pattern": "\\b(?:here(?:'s| is) the thing|let(?:'s| us) dive in|here(?:'s| is) what you need to know|let(?:'s| us) break (?:it|this) down)\\b",
    "flags": "gi",
    "message": "Staged opener may announce the point instead of stating it.",
    "rewrite": "Start with the substantive claim."
  },
  {
    "id": "en-contrast-001",
    "locale": "en-US",
    "category": "staging",
    "severity": "P1",
    "evidence": "E2",
    "type": "regex",
    "pattern": "\\bnot (?:just|only|merely)?[^.!?;]{1,45}\\bbut\\b[^.!?;]{1,65}",
    "flags": "gi",
    "message": "Check whether the negative half corrects a real belief.",
    "rewrite": "If not, state the positive claim directly."
  },
  {
    "id": "en-closer-001",
    "locale": "en-US",
    "category": "leftovers",
    "severity": "P1",
    "evidence": "E2",
    "type": "regex",
    "pattern": "\\b(?:that(?:'s| is) the real win|let that sink in|read that again|and that changes everything)\\b",
    "flags": "gi",
    "message": "Dramatic closer may repeat the preceding point.",
    "rewrite": "Cut it unless it adds new information."
  },
  {
    "id": "en-inflation-001",
    "locale": "en-US",
    "category": "inflation",
    "severity": "P1",
    "evidence": "E2",
    "type": "regex",
    "pattern": "\\b(?:pivotal moment|game[- ]changer|groundbreaking|transformative|stands as a testament|marks a new era|paradigm shift)\\b",
    "flags": "gi",
    "message": "Potentially inflated significance.",
    "rewrite": "Keep the concrete fact unless the significance is sourced."
  },
  {
    "id": "en-jargon-001",
    "locale": "en-US",
    "category": "semantic-emptiness",
    "severity": "P3",
    "evidence": "E1",
    "type": "regex",
    "pattern": "\\b(?:leverage|synergy|ecosystem|holistic|streamline|unlock|enable|empower)\\b",
    "flags": "gi",
    "message": "Business jargon is a weak signal; check for a missing actor/action/result.",
    "rewrite": "Use concrete actors and actions when the source provides them."
  },
  {
    "id": "en-vocab-001",
    "locale": "en-US",
    "category": "lexical",
    "severity": "P3",
    "evidence": "E1",
    "type": "regex",
    "pattern": "\\b(?:delve|robust|seamless|landscape|pivotal|intricate|underscore|showcase|tapestry|multifaceted)\\b",
    "flags": "gi",
    "message": "Stock model vocabulary is weak alone; act only when clustered with other signals.",
    "rewrite": "Replace only when a plainer or more precise word fits the context."
  },
  {
    "id": "en-summary-001",
    "locale": "en-US",
    "category": "leftovers",
    "severity": "P2",
    "evidence": "E1",
    "type": "regex",
    "pattern": "\\b(?:in conclusion|to sum up|all in all|at the end of the day)\\b",
    "flags": "gi",
    "message": "Check whether the conclusion adds information or merely restates the body.",
    "rewrite": "End on the last concrete fact or decision when possible."
  },
  {
    "id": "en-attribution-001",
    "locale": "en-US",
    "category": "semantic-emptiness",
    "severity": "P2",
    "evidence": "E1",
    "type": "regex",
    "pattern": "\\b(?:experts say|research shows|studies show|many believe|it is widely believed)\\b",
    "flags": "gi",
    "message": "Vague attribution may borrow authority without a source.",
    "rewrite": "Name the source if present; otherwise remove the unsupported authority cue."
  },
  {
    "id": "en-qualifier-001",
    "locale": "en-US",
    "category": "rhythm",
    "severity": "P2",
    "evidence": "E1",
    "type": "regex",
    "pattern": "\\b(?:could potentially|might arguably|potentially possibly|in some cases it may)\\b",
    "flags": "gi",
    "message": "Stacked qualifiers can make a claim mechanically hedged.",
    "rewrite": "Keep only the uncertainty actually required by the source."
  },
  {
    "id": "en-meta-001",
    "locale": "en-US",
    "category": "leftovers",
    "severity": "P0",
    "evidence": "E3",
    "type": "regex",
    "pattern": "\\b(?:I hope this helps|if you(?:'d| would) like, I can|below I(?:'ll| will)|now let(?:'s| us) look at)\\b",
    "flags": "gi",
    "message": "Likely chatbot or drafting-process residue.",
    "rewrite": "Remove process-facing wrapper text."
  },
  {
    "id": "en-format-001",
    "locale": "en-US",
    "category": "formatting",
    "severity": "P2",
    "evidence": "E1",
    "type": "regex",
    "pattern": "(?:^|\\n)\\*\\*(?:Key takeaway|Why it matters|Bottom line|The big picture):\\*\\*",
    "flags": "gim",
    "message": "Repeated bold labels can create a templated assistant voice.",
    "rewrite": "Use normal prose or headings only when the structure genuinely helps."
  },
  {
    "id": "en-future-001",
    "locale": "en-US",
    "category": "inflation",
    "severity": "P2",
    "evidence": "E1",
    "type": "regex",
    "pattern": "\\b(?:the future looks bright|exciting times ahead|the possibilities are endless|only time will tell)\\b",
    "flags": "gi",
    "message": "Generic future-looking send-off may add no supported information.",
    "rewrite": "End with a sourced plan, constraint, or concrete fact instead."
  }
]
